{
  "schema_version": "2.0.0",
  "directory_metadata": {
    "path": "candidate/core/safety",
    "lane": "development",
    "purpose": "Directory containing 3 Python files and 0 subdirectories",
    "trinity_role": [],
    "last_updated": "2025-09-20"
  },
  "component_inventory": {
    "python_files": [
      {
        "filename": "constitutional_safety.py",
        "component_type": "UTILITY",
        "has_contract": false,
        "contract_path": null,
        "dependencies": [],
        "exports": []
      },
      {
        "filename": "multi_agent_consensus.py",
        "component_type": "UTILITY",
        "has_contract": false,
        "contract_path": null,
        "dependencies": [],
        "exports": [
          "AgentRole",
          "AgentVote",
          "ConsensusResult",
          "SafetyAgent",
          "MultiAgentSafetyConsensus",
          "get_multi_agent_consensus",
          "get_agent_performance_metrics",
          "get_consensus_statistics"
        ]
      },
      {
        "filename": "safety_hub.py",
        "component_type": "UTILITY",
        "has_contract": false,
        "contract_path": null,
        "dependencies": [
          "candidate.core.integration.service_discovery"
        ],
        "exports": [
          "SafetyHub",
          "get_safety_hub",
          "register_service",
          "get_service",
          "register_event_handler",
          "get_safety_status",
          "get_service_list",
          "get_service_count"
        ]
      }
    ],
    "subdirectories": [],
    "documentation": []
  },
  "schema_references": [
    {
      "schema_name": "directory_index",
      "schema_path": "schemas/directory_index.schema.json",
      "validation_status": "valid"
    }
  ],
  "agent_guidance": {
    "recommended_approach": "Begin with documentation files, then explore core components",
    "key_files": [],
    "common_tasks": [],
    "prerequisites": [
      "Understanding of LUKHAS lane system",
      "Trinity Framework familiarity"
    ],
    "avoid_patterns": [
      "Modifying contracts without validation",
      "Breaking lane boundaries",
      "Ignoring Trinity Framework integration"
    ]
  },
  "performance_metadata": {
    "component_count": 3,
    "estimated_complexity": "low",
    "consciousness_integration": "none",
    "test_coverage": 85.0
  },
  "relationships": {
    "parent_directory": "candidate/core",
    "related_directories": [],
    "constellation_cluster": "unknown",
    "dependency_weight": "moderate"
  }
}