{
  "schema_version": "2.0.0",
  "directory_metadata": {
    "path": "candidate/qi/states",
    "lane": "development",
    "purpose": "Directory containing 21 Python files and 0 subdirectories",
    "trinity_role": [],
    "last_updated": "2025-09-20"
  },
  "component_inventory": {
    "python_files": [
      {
        "filename": "qi_state_modifier.py",
        "component_type": "UTILITY",
        "has_contract": false,
        "contract_path": null,
        "dependencies": [],
        "exports": [
          "QILikeStateModifier"
        ]
      },
      {
        "filename": "intent_inference.py",
        "component_type": "UTILITY",
        "has_contract": false,
        "contract_path": null,
        "dependencies": [],
        "exports": [
          "infer_intent"
        ]
      },
      {
        "filename": "system_orchestrator.py",
        "component_type": "UTILITY",
        "has_contract": false,
        "contract_path": null,
        "dependencies": [],
        "exports": [
          "QIAGISystem",
          "get_dream_adapter_status",
          "get_voice_enhancer_status"
        ]
      },
      {
        "filename": "web_integration.py",
        "component_type": "UTILITY",
        "has_contract": false,
        "contract_path": null,
        "dependencies": [],
        "exports": [
          "QISecurityLevel",
          "QIWebSession",
          "QIWebSecurity",
          "QIWebAuthenticator"
        ]
      },
      {
        "filename": "coordinator.py",
        "component_type": "UTILITY",
        "has_contract": false,
        "contract_path": null,
        "dependencies": [],
        "exports": []
      },
      {
        "filename": "service.py",
        "component_type": "UTILITY",
        "has_contract": true,
        "contract_path": "contracts/consciousness/service.json",
        "dependencies": [],
        "exports": [
          "QIService",
          "IdentityClient",
          "qi_compute",
          "qi_entangle",
          "consciousness_quantum_bridge",
          "qi_compute",
          "qi_entangle",
          "consciousness_quantum_bridge",
          "qi_superposition",
          "observe_quantum_like_state",
          "get_quantum_metrics",
          "verify_user_access",
          "check_consent",
          "log_activity"
        ]
      },
      {
        "filename": "trace.py",
        "component_type": "UTILITY",
        "has_contract": false,
        "contract_path": null,
        "dependencies": [],
        "exports": [
          "CollapseTrace",
          "get_global_tracer",
          "log_collapse",
          "get_collapse_history"
        ]
      },
      {
        "filename": "lidar_emotion_interpreter.py",
        "component_type": "EMOTION_PROCESSOR",
        "has_contract": false,
        "contract_path": null,
        "dependencies": [],
        "exports": [
          "interpret_emotional_state",
          "generate_collapse_hash"
        ]
      },
      {
        "filename": "\u039bBot_qi_security.py",
        "component_type": "UTILITY",
        "has_contract": false,
        "contract_path": null,
        "dependencies": [],
        "exports": [
          "QIThreat",
          "SecurityAssessment",
          "PostQuantumCryptographyEngine",
          "BioSymbolicThreatDetector",
          "QIVulnerabilityAnalyzer",
          "AdaptiveSecurityOrchestrator",
          "\u039bBotQuantumSecurityOrchestrator",
          "LatticeBasedCrypto",
          "MultivariateCrypto",
          "HashBasedSignatures",
          "CodeBasedCrypto",
          "IsogenyCrypto"
        ]
      },
      {
        "filename": "phase_qi_integration.py",
        "component_type": "TEST",
        "has_contract": false,
        "contract_path": null,
        "dependencies": [
          "candidate.core.identity.identity_engine",
          "candidate.core.integration.governance.__init__",
          "candidate.core.testing.plugin_test_framework"
        ],
        "exports": [
          "QIIntegrationTestSuite"
        ]
      },
      {
        "filename": "reasoner.py",
        "component_type": "UTILITY",
        "has_contract": false,
        "contract_path": null,
        "dependencies": [],
        "exports": [
          "CollapseType",
          "ResolutionStrategy",
          "ReasoningChain",
          "CollapseResult",
          "QICollapseEngine",
          "initiate_collapse",
          "evaluate_branch_stability",
          "emit_collapse_event",
          "log_entropy_threshold_crossing",
          "get_collapse_statistics"
        ]
      },
      {
        "filename": "voice_enhancer.py",
        "component_type": "UTILITY",
        "has_contract": false,
        "contract_path": null,
        "dependencies": [],
        "exports": [
          "VoiceQuantumConfig",
          "QIVoiceEnhancer"
        ]
      },
      {
        "filename": "bridge.py",
        "component_type": "TRINITY_BRIDGE",
        "has_contract": true,
        "contract_path": "contracts/consciousness/bridge.json",
        "dependencies": [],
        "exports": [
          "CollapseBridge",
          "record_collapse",
          "get_metrics",
          "record_event",
          "get_current_metrics",
          "clear_events"
        ]
      },
      {
        "filename": "processor.py",
        "component_type": "UTILITY",
        "has_contract": false,
        "contract_path": null,
        "dependencies": [],
        "exports": [
          "QIInspiredProcessor",
          "create_quantum_component",
          "get_status"
        ]
      },
      {
        "filename": "integration.py",
        "component_type": "TEST",
        "has_contract": false,
        "contract_path": null,
        "dependencies": [
          "candidate.core.bio_systems.qi_layer"
        ],
        "exports": [
          "TestQuantumIntegration",
          "setUp",
          "test_superposition_transition",
          "test_entanglement",
          "test_decoherence",
          "test_measurement",
          "test_orchestrator_quantum_management",
          "test_generate_quantum_values"
        ]
      },
      {
        "filename": "vault_manager.py",
        "component_type": "UTILITY",
        "has_contract": false,
        "contract_path": null,
        "dependencies": [],
        "exports": [
          "VeriFoldQR",
          "EncryptedAPIKey",
          "AnonymousCryptoSession",
          "QISeedPhrase",
          "QIVaultManager",
          "main",
          "create_lambda_id_hash",
          "generate_verifold_qr",
          "store_encrypted_api_key",
          "authenticate_and_decrypt_api_key",
          "create_anonymous_crypto_session",
          "store_quantum_seed_phrase",
          "get_anonymous_trading_session",
          "generate_vault_report"
        ]
      },
      {
        "filename": "engine.py",
        "component_type": "UTILITY",
        "has_contract": true,
        "contract_path": "contracts/consciousness/engine.json",
        "dependencies": [
          "candidate.core.monitoring.collapse_tracker"
        ],
        "exports": [
          "MemoryNode",
          "CollapseResult",
          "CollapseEngine",
          "get_global_engine",
          "compute_hash",
          "to_dict",
          "collapse_nodes",
          "get_collapse_metrics",
          "visualize_collapse_graph"
        ]
      },
      {
        "filename": "integrity_probe.py",
        "component_type": "UTILITY",
        "has_contract": false,
        "contract_path": null,
        "dependencies": [
          "candidate.core.symbolic_diagnostics.trace_repair_engine",
          "lukhas.memory.core_memory.memory_collapse_verifier"
        ],
        "exports": [
          "IntegrityProbe",
          "run_consistency_check"
        ]
      },
      {
        "filename": "buffer.py",
        "component_type": "UTILITY",
        "has_contract": false,
        "contract_path": null,
        "dependencies": [],
        "exports": [
          "CollapseBuffer",
          "buffer_event"
        ]
      },
      {
        "filename": "safe_blockchain.py",
        "component_type": "UTILITY",
        "has_contract": false,
        "contract_path": null,
        "dependencies": [],
        "exports": [
          "QISafeAuditBlockchain"
        ]
      },
      {
        "filename": "entanglement.py",
        "component_type": "UTILITY",
        "has_contract": false,
        "contract_path": null,
        "dependencies": [],
        "exports": [
          "QIEntanglement",
          "create_quantum_component",
          "get_status"
        ]
      }
    ],
    "subdirectories": [],
    "documentation": []
  },
  "schema_references": [
    {
      "schema_name": "directory_index",
      "schema_path": "schemas/directory_index.schema.json",
      "validation_status": "valid"
    }
  ],
  "agent_guidance": {
    "recommended_approach": "Begin with documentation files, then explore core components",
    "key_files": [],
    "common_tasks": [],
    "prerequisites": [
      "Understanding of LUKHAS lane system",
      "Constellation Framework familiarity"
    ],
    "avoid_patterns": [
      "Modifying contracts without validation",
      "Breaking lane boundaries",
      "Ignoring Constellation Framework integration"
    ]
  },
  "performance_metadata": {
    "component_count": 21,
    "estimated_complexity": "high",
    "consciousness_integration": "none",
    "test_coverage": 85.0
  },
  "relationships": {
    "parent_directory": "candidate/qi",
    "related_directories": [],
    "constellation_cluster": "unknown",
    "dependency_weight": "moderate"
  }
}