{
  "schema_version": "2.0.0",
  "directory_metadata": {
    "path": "branding/intelligence",
    "lane": "development",
    "purpose": "Directory containing 2 Python files and 0 subdirectories",
    "trinity_role": [],
    "last_updated": "2025-09-20"
  },
  "component_inventory": {
    "python_files": [
      {
        "filename": "brand_monitor.py",
        "component_type": "UTILITY",
        "has_contract": false,
        "contract_path": null,
        "dependencies": [],
        "exports": [
          "BrandIntelligenceMonitor",
          "create_brand_alert_display",
          "analyze_brand_consistency",
          "perform_comprehensive_brand_analysis",
          "generate_brand_intelligence",
          "generate_brand_predictions",
          "generate_brand_recommendations"
        ]
      },
      {
        "filename": "sentiment_engine.py",
        "component_type": "UTILITY",
        "has_contract": false,
        "contract_path": null,
        "dependencies": [],
        "exports": [
          "SentimentPolarity",
          "BrandDimension",
          "SentimentResult",
          "BrandSentimentEngine",
          "create_sentiment_symbolic_display",
          "analyze_sentiment",
          "get_sentiment_trends",
          "analyze_brand_perception_evolution",
          "generate_sentiment_report"
        ]
      }
    ],
    "subdirectories": [],
    "documentation": []
  },
  "schema_references": [
    {
      "schema_name": "directory_index",
      "schema_path": "schemas/directory_index.schema.json",
      "validation_status": "valid"
    }
  ],
  "agent_guidance": {
    "recommended_approach": "Begin with documentation files, then explore core components",
    "key_files": [],
    "common_tasks": [],
    "prerequisites": [
      "Understanding of LUKHAS lane system",
      "Constellation Framework familiarity"
    ],
    "avoid_patterns": [
      "Modifying contracts without validation",
      "Breaking lane boundaries",
      "Ignoring Constellation Framework integration"
    ]
  },
  "performance_metadata": {
    "component_count": 2,
    "estimated_complexity": "low",
    "consciousness_integration": "none",
    "test_coverage": 85.0
  },
  "relationships": {
    "parent_directory": "branding",
    "related_directories": [],
    "constellation_cluster": "unknown",
    "dependency_weight": "moderate"
  }
}