{
  "schema_version": "2.0.0",
  "directory_metadata": {
    "path": "api",
    "lane": "development",
    "purpose": "Directory containing 7 Python files and 2 subdirectories",
    "trinity_role": [],
    "last_updated": "2025-09-20"
  },
  "component_inventory": {
    "python_files": [
      {
        "filename": "feedback_api.py",
        "component_type": "API_INTERFACE",
        "has_contract": false,
        "contract_path": null,
        "dependencies": [
          "lukhas.core.common",
          "lukhas.core.interfaces.dependency_injection"
        ],
        "exports": [
          "FeedbackRequest",
          "QuickFeedbackRequest",
          "EmojiFeedbackRequest",
          "TextFeedbackRequest",
          "FeedbackEditRequest",
          "FeedbackResponse",
          "FeedbackHistoryResponse",
          "FeedbackSummaryResponse",
          "ConsentRequest",
          "Config",
          "Config",
          "validate_emoji"
        ]
      },
      {
        "filename": "models.py",
        "component_type": "API_INTERFACE",
        "has_contract": false,
        "contract_path": null,
        "dependencies": [],
        "exports": [
          "StatusResponse",
          "ConsciousnessStatus",
          "AwarenessLevel",
          "SetAwarenessRequest",
          "MemoryQueryRequest",
          "MemoryQueryResponse",
          "DreamStateRequest",
          "DreamStateResponse",
          "UserIdentity",
          "CreateUserRequest",
          "UpdateUserRequest",
          "AuthRequest",
          "AuthToken",
          "AuthzRequest",
          "AuthzResponse",
          "ConsolidateRequest",
          "SafetyProtocols",
          "EthicsMonitorData",
          "ComplianceCheckRequest",
          "ComplianceCheckResponse",
          "AuditTrailRequest",
          "AuditTrailResponse"
        ]
      },
      {
        "filename": "expansion_api.py",
        "component_type": "API_INTERFACE",
        "has_contract": false,
        "contract_path": null,
        "dependencies": [],
        "exports": []
      },
      {
        "filename": "universal_language_api.py",
        "component_type": "API_INTERFACE",
        "has_contract": false,
        "contract_path": null,
        "dependencies": [
          "lukhas.consciousness.reflection.openai_modulated_service",
          "lukhas.core.colonies.consensus_mechanisms",
          "lukhas.core.colonies.enhanced_colony",
          "lukhas.orchestration.gpt_colony_orchestrator",
          "lukhas.orchestration.signals.signal_bus"
        ],
        "exports": [
          "MultiModalInput",
          "SymbolUnderstandingRequest",
          "SymbolUnderstandingResponse",
          "PasswordGenerationRequest",
          "PasswordGenerationResponse",
          "ExchangeInitiationRequest",
          "LanguageBuildRequest",
          "ColonyConsensusRequest",
          "calculate_entropy",
          "estimate_cracking_time",
          "get_strength_rating"
        ]
      },
      {
        "filename": "consciousness_chat_api.py",
        "component_type": "API_INTERFACE",
        "has_contract": false,
        "contract_path": null,
        "dependencies": [
          "lukhas.consciousness.interfaces.natural_language_interface",
          "lukhas.core.common",
          "lukhas.core.interfaces.dependency_injection"
        ],
        "exports": [
          "ChatRequest",
          "ChatResponse",
          "SessionInfo",
          "SystemStatus",
          "Config",
          "Config"
        ]
      },
      {
        "filename": "integrated_consciousness_api.py",
        "component_type": "API_INTERFACE",
        "has_contract": false,
        "contract_path": null,
        "dependencies": [
          "lukhas.consciousness.interfaces.natural_language_interface",
          "lukhas.core.common",
          "lukhas.core.interfaces.dependency_injection"
        ],
        "exports": [
          "IntegratedChatRequest",
          "IntegratedChatResponse",
          "ConversationFeedback",
          "DashboardRequest",
          "Config",
          "Config",
          "Config"
        ]
      },
      {
        "filename": "expansion.py",
        "component_type": "API_INTERFACE",
        "has_contract": false,
        "contract_path": null,
        "dependencies": [],
        "exports": [
          "LUKHASAPIExpansion",
          "design_consciousness_apis",
          "implement_identity_management_apis",
          "create_guardian_integration_apis"
        ]
      }
    ],
    "subdirectories": [
      {
        "name": "public",
        "has_index": false,
        "purpose": "Subdirectory with 0 Python files",
        "component_count": 0
      },
      {
        "name": "api_hub",
        "has_index": false,
        "purpose": "Subdirectory with 1 Python files",
        "component_count": 1
      }
    ],
    "documentation": []
  },
  "schema_references": [
    {
      "schema_name": "directory_index",
      "schema_path": "schemas/directory_index.schema.json",
      "validation_status": "valid"
    }
  ],
  "agent_guidance": {
    "recommended_approach": "Examine API contracts and integration patterns first",
    "key_files": [],
    "common_tasks": [
      {
        "task": "API integration",
        "files_involved": [
          "feedback_api.py",
          "models.py",
          "expansion_api.py",
          "universal_language_api.py",
          "consciousness_chat_api.py",
          "integrated_consciousness_api.py",
          "expansion.py"
        ],
        "complexity": "medium"
      }
    ],
    "prerequisites": [
      "Understanding of LUKHAS lane system",
      "Trinity Framework familiarity"
    ],
    "avoid_patterns": [
      "Modifying contracts without validation",
      "Breaking lane boundaries",
      "Ignoring Trinity Framework integration"
    ]
  },
  "performance_metadata": {
    "component_count": 7,
    "estimated_complexity": "medium",
    "consciousness_integration": "none",
    "test_coverage": 85.0
  },
  "relationships": {
    "parent_directory": null,
    "related_directories": [],
    "constellation_cluster": "unknown",
    "dependency_weight": "moderate"
  }
}