{
  "schema_version": "2.0.0",
  "directory_metadata": {
    "path": "candidate/core/engines",
    "lane": "development",
    "purpose": "Directory containing 5 Python files and 0 subdirectories",
    "trinity_role": [],
    "last_updated": "2025-09-20"
  },
  "component_inventory": {
    "python_files": [
      {
        "filename": "identity_engine.py",
        "component_type": "UTILITY",
        "has_contract": false,
        "contract_path": null,
        "dependencies": [],
        "exports": [
          "Identityengine",
          "get_metrics"
        ]
      },
      {
        "filename": "learning_engine.py",
        "component_type": "UTILITY",
        "has_contract": false,
        "contract_path": null,
        "dependencies": [],
        "exports": [
          "Learningengine",
          "get_metrics"
        ]
      },
      {
        "filename": "creative_engine.py",
        "component_type": "CREATIVITY_ENGINE",
        "has_contract": true,
        "contract_path": "contracts/consciousness/creative_engine.json",
        "dependencies": [],
        "exports": [
          "Creativeengine",
          "get_metrics"
        ]
      },
      {
        "filename": "consciousness_engine.py",
        "component_type": "CONSCIOUSNESS_ENGINE",
        "has_contract": false,
        "contract_path": null,
        "dependencies": [],
        "exports": [
          "Consciousnessengine",
          "get_metrics"
        ]
      },
      {
        "filename": "communication_engine.py",
        "component_type": "UTILITY",
        "has_contract": false,
        "contract_path": null,
        "dependencies": [],
        "exports": [
          "Communicationengine",
          "get_metrics"
        ]
      }
    ],
    "subdirectories": [],
    "documentation": []
  },
  "schema_references": [
    {
      "schema_name": "directory_index",
      "schema_path": "schemas/directory_index.schema.json",
      "validation_status": "valid"
    }
  ],
  "agent_guidance": {
    "recommended_approach": "Begin with documentation files, then explore core components",
    "key_files": [
      "consciousness_engine.py"
    ],
    "common_tasks": [
      {
        "task": "Consciousness engine development",
        "files_involved": [
          "consciousness_engine.py"
        ],
        "complexity": "high"
      }
    ],
    "prerequisites": [
      "Understanding of LUKHAS lane system",
      "Trinity Framework familiarity"
    ],
    "avoid_patterns": [
      "Modifying contracts without validation",
      "Breaking lane boundaries",
      "Ignoring Trinity Framework integration"
    ]
  },
  "performance_metadata": {
    "component_count": 5,
    "estimated_complexity": "low",
    "consciousness_integration": "intermediate",
    "test_coverage": 85.0
  },
  "relationships": {
    "parent_directory": "candidate/core",
    "related_directories": [],
    "constellation_cluster": "unknown",
    "dependency_weight": "moderate"
  }
}