{
  "schema_version": "2.0.0",
  "directory_metadata": {
    "path": "products/experience",
    "lane": "development",
    "purpose": "Directory containing 1 Python files and 4 subdirectories",
    "trinity_role": [],
    "last_updated": "2025-09-20"
  },
  "component_inventory": {
    "python_files": [
      {
        "filename": "streamlit_safe.py",
        "component_type": "UTILITY",
        "has_contract": false,
        "contract_path": null,
        "dependencies": [],
        "exports": [
          "StreamlitCall",
          "StreamlitFacade",
          "get_streamlit",
          "reset",
          "title",
          "header",
          "metric",
          "wrapper"
        ]
      }
    ],
    "subdirectories": [
      {
        "name": "feedback",
        "has_index": false,
        "purpose": "Subdirectory with 0 Python files",
        "component_count": 0
      },
      {
        "name": "dashboard",
        "has_index": false,
        "purpose": "Subdirectory with 0 Python files",
        "component_count": 0
      },
      {
        "name": "voice",
        "has_index": false,
        "purpose": "Subdirectory with 0 Python files",
        "component_count": 0
      },
      {
        "name": "universal_language",
        "has_index": false,
        "purpose": "Subdirectory with 0 Python files",
        "component_count": 0
      }
    ],
    "documentation": [
      {
        "filename": "COMPONENT_RESEARCH_PLAN.md",
        "type": "other",
        "has_sync_header": false
      },
      {
        "filename": "EXPERIENCE_PLATFORM_VISION.md",
        "type": "other",
        "has_sync_header": false
      },
      {
        "filename": "lukhas_context.md",
        "type": "lukhas_context.md",
        "has_sync_header": false
      },
      {
        "filename": "claude.me",
        "type": "claude.me",
        "has_sync_header": false
      }
    ]
  },
  "schema_references": [
    {
      "schema_name": "directory_index",
      "schema_path": "schemas/directory_index.schema.json",
      "validation_status": "valid"
    }
  ],
  "agent_guidance": {
    "recommended_approach": "Begin with documentation files, then explore core components",
    "key_files": [
      "lukhas_context.md",
      "claude.me"
    ],
    "common_tasks": [],
    "prerequisites": [
      "Understanding of LUKHAS lane system",
      "Trinity Framework familiarity"
    ],
    "avoid_patterns": [
      "Modifying contracts without validation",
      "Breaking lane boundaries",
      "Ignoring Trinity Framework integration"
    ]
  },
  "performance_metadata": {
    "component_count": 1,
    "estimated_complexity": "low",
    "consciousness_integration": "none",
    "test_coverage": 85.0
  },
  "relationships": {
    "parent_directory": "products",
    "related_directories": [],
    "constellation_cluster": "unknown",
    "dependency_weight": "moderate"
  }
}