{
  "schema_version": "2.0.0",
  "directory_metadata": {
    "path": "reasoning",
    "lane": "development",
    "purpose": "Directory containing 0 Python files and 12 subdirectories",
    "trinity_role": [],
    "last_updated": "2025-09-20"
  },
  "component_inventory": {
    "python_files": [],
    "subdirectories": [
      {
        "name": "causal_reasoning",
        "has_index": false,
        "purpose": "Subdirectory with 1 Python files",
        "component_count": 1
      },
      {
        "name": "causal_reasoning_module",
        "has_index": false,
        "purpose": "Subdirectory with 1 Python files",
        "component_count": 1
      },
      {
        "name": "collapse_reasoner",
        "has_index": false,
        "purpose": "Subdirectory with 1 Python files",
        "component_count": 1
      },
      {
        "name": "causal_program_inducer",
        "has_index": false,
        "purpose": "Subdirectory with 1 Python files",
        "component_count": 1
      },
      {
        "name": "oracle_predictor",
        "has_index": false,
        "purpose": "Subdirectory with 1 Python files",
        "component_count": 1
      },
      {
        "name": "trace_summary_builder",
        "has_index": false,
        "purpose": "Subdirectory with 1 Python files",
        "component_count": 1
      },
      {
        "name": "symbolic_reasoning",
        "has_index": false,
        "purpose": "Subdirectory with 1 Python files",
        "component_count": 1
      },
      {
        "name": "adaptive_reasoning_loop",
        "has_index": false,
        "purpose": "Subdirectory with 1 Python files",
        "component_count": 1
      },
      {
        "name": "openai_oracle_adapter",
        "has_index": false,
        "purpose": "Subdirectory with 1 Python files",
        "component_count": 1
      },
      {
        "name": "reasoning_metrics",
        "has_index": false,
        "purpose": "Subdirectory with 1 Python files",
        "component_count": 1
      },
      {
        "name": "causal_reasoning_engine",
        "has_index": false,
        "purpose": "Subdirectory with 1 Python files",
        "component_count": 1
      },
      {
        "name": "reasoning_engine",
        "has_index": false,
        "purpose": "Subdirectory with 1 Python files",
        "component_count": 1
      }
    ],
    "documentation": []
  },
  "schema_references": [
    {
      "schema_name": "directory_index",
      "schema_path": "schemas/directory_index.schema.json",
      "validation_status": "valid"
    }
  ],
  "agent_guidance": {
    "recommended_approach": "Begin with documentation files, then explore core components",
    "key_files": [],
    "common_tasks": [],
    "prerequisites": [
      "Understanding of LUKHAS lane system",
      "Constellation Framework familiarity"
    ],
    "avoid_patterns": [
      "Modifying contracts without validation",
      "Breaking lane boundaries",
      "Ignoring Constellation Framework integration"
    ]
  },
  "performance_metadata": {
    "component_count": 0,
    "estimated_complexity": "low",
    "consciousness_integration": "none",
    "test_coverage": 85.0
  },
  "relationships": {
    "parent_directory": null,
    "related_directories": [],
    "constellation_cluster": "unknown",
    "dependency_weight": "moderate"
  }
}