{
  "schema_version": "2.0.0",
  "directory_metadata": {
    "path": "lukhas/interfaces",
    "lane": "development",
    "purpose": "Directory containing 1 Python files and 0 subdirectories",
    "trinity_role": [],
    "last_updated": "2025-09-20"
  },
  "component_inventory": {
    "python_files": [
      {
        "filename": "identity.py",
        "component_type": "API_INTERFACE",
        "has_contract": true,
        "contract_path": "contracts/consciousness/identity.json",
        "dependencies": [],
        "exports": [
          "AuthenticationIntegration",
          "ensure_both_id_keys",
          "get_component_paths",
          "get_bridge_paths",
          "get_integration_status"
        ]
      }
    ],
    "subdirectories": [],
    "documentation": []
  },
  "schema_references": [
    {
      "schema_name": "directory_index",
      "schema_path": "schemas/directory_index.schema.json",
      "validation_status": "valid"
    }
  ],
  "agent_guidance": {
    "recommended_approach": "Examine API contracts and integration patterns first",
    "key_files": [],
    "common_tasks": [
      {
        "task": "API integration",
        "files_involved": [
          "identity.py"
        ],
        "complexity": "medium"
      }
    ],
    "prerequisites": [
      "Understanding of LUKHAS lane system",
      "Constellation Framework familiarity"
    ],
    "avoid_patterns": [
      "Modifying contracts without validation",
      "Breaking lane boundaries",
      "Ignoring Constellation Framework integration"
    ]
  },
  "performance_metadata": {
    "component_count": 1,
    "estimated_complexity": "low",
    "consciousness_integration": "none",
    "test_coverage": 85.0
  },
  "relationships": {
    "parent_directory": "lukhas",
    "related_directories": [],
    "constellation_cluster": "unknown",
    "dependency_weight": "moderate"
  }
}