{
  "schema_version": "2.0.0",
  "directory_metadata": {
    "path": "tools/headers",
    "lane": "development",
    "purpose": "Directory containing 9 Python files and 0 subdirectories",
    "trinity_role": [],
    "last_updated": "2025-09-20"
  },
  "component_inventory": {
    "python_files": [
      {
        "filename": "add_module_descriptions.py",
        "component_type": "UTILITY",
        "has_contract": false,
        "contract_path": null,
        "dependencies": [],
        "exports": [
          "add_module_description",
          "main"
        ]
      },
      {
        "filename": "add_poetic_headers.py",
        "component_type": "UTILITY",
        "has_contract": false,
        "contract_path": null,
        "dependencies": [],
        "exports": [
          "get_module_description",
          "format_poetry",
          "has_existing_header",
          "add_poetic_header",
          "main"
        ]
      },
      {
        "filename": "fix_proper_ascii.py",
        "component_type": "UTILITY",
        "has_contract": false,
        "contract_path": null,
        "dependencies": [],
        "exports": [
          "fix_ascii_in_file",
          "main"
        ]
      },
      {
        "filename": "fix_ascii_headers.py",
        "component_type": "UTILITY",
        "has_contract": false,
        "contract_path": null,
        "dependencies": [],
        "exports": [
          "fix_ascii_in_file",
          "main"
        ]
      },
      {
        "filename": "HEADER_TEMPLATE.py",
        "component_type": "UTILITY",
        "has_contract": false,
        "contract_path": null,
        "dependencies": [],
        "exports": []
      },
      {
        "filename": "fix_module_descriptions.py",
        "component_type": "UTILITY",
        "has_contract": false,
        "contract_path": null,
        "dependencies": [],
        "exports": [
          "fix_description",
          "main"
        ]
      },
      {
        "filename": "add_intelligent_descriptions.py",
        "component_type": "UTILITY",
        "has_contract": false,
        "contract_path": null,
        "dependencies": [],
        "exports": [
          "analyze_code_content",
          "generate_intelligent_description",
          "add_intelligent_description",
          "main"
        ]
      },
      {
        "filename": "add_verbose_intelligent_descriptions.py",
        "component_type": "UTILITY",
        "has_contract": false,
        "contract_path": null,
        "dependencies": [],
        "exports": [
          "analyze_quantum_code",
          "generate_verbose_description",
          "add_verbose_description",
          "main",
          "find_good_candidates",
          "estimate_costs",
          "run_cost_analysis"
        ]
      },
      {
        "filename": "add_template_reference.py",
        "component_type": "UTILITY",
        "has_contract": false,
        "contract_path": null,
        "dependencies": [],
        "exports": [
          "add_template_reference",
          "main"
        ]
      }
    ],
    "subdirectories": [],
    "documentation": []
  },
  "schema_references": [
    {
      "schema_name": "directory_index",
      "schema_path": "schemas/directory_index.schema.json",
      "validation_status": "valid"
    }
  ],
  "agent_guidance": {
    "recommended_approach": "Begin with documentation files, then explore core components",
    "key_files": [],
    "common_tasks": [],
    "prerequisites": [
      "Understanding of LUKHAS lane system",
      "Constellation Framework familiarity"
    ],
    "avoid_patterns": [
      "Modifying contracts without validation",
      "Breaking lane boundaries",
      "Ignoring Constellation Framework integration"
    ]
  },
  "performance_metadata": {
    "component_count": 9,
    "estimated_complexity": "medium",
    "consciousness_integration": "none",
    "test_coverage": 85.0
  },
  "relationships": {
    "parent_directory": "tools",
    "related_directories": [],
    "constellation_cluster": "unknown",
    "dependency_weight": "moderate"
  }
}