{
  "schema_version": "2.0.0",
  "directory_metadata": {
    "path": "next_gen/bridge",
    "lane": "development",
    "purpose": "Directory containing 1 Python files and 0 subdirectories",
    "trinity_role": [],
    "last_updated": "2025-09-20"
  },
  "component_inventory": {
    "python_files": [
      {
        "filename": "sso_bridge.py",
        "component_type": "TRINITY_BRIDGE",
        "has_contract": false,
        "contract_path": null,
        "dependencies": [],
        "exports": [
          "SSOProvider",
          "SSOSession",
          "SSOTransaction",
          "SSOBridge",
          "initiate_sso_flow",
          "handle_sso_callback",
          "validate_session",
          "logout_session",
          "get_user_glyphs",
          "add_provider",
          "get_system_status"
        ]
      }
    ],
    "subdirectories": [],
    "documentation": []
  },
  "schema_references": [
    {
      "schema_name": "directory_index",
      "schema_path": "schemas/directory_index.schema.json",
      "validation_status": "valid"
    }
  ],
  "agent_guidance": {
    "recommended_approach": "Begin with documentation files, then explore core components",
    "key_files": [],
    "common_tasks": [],
    "prerequisites": [
      "Understanding of LUKHAS lane system",
      "Constellation Framework familiarity"
    ],
    "avoid_patterns": [
      "Modifying contracts without validation",
      "Breaking lane boundaries",
      "Ignoring Constellation Framework integration"
    ]
  },
  "performance_metadata": {
    "component_count": 1,
    "estimated_complexity": "low",
    "consciousness_integration": "none",
    "test_coverage": 85.0
  },
  "relationships": {
    "parent_directory": "next_gen",
    "related_directories": [],
    "constellation_cluster": "unknown",
    "dependency_weight": "moderate"
  }
}