{
  "schema_version": "2.0.0",
  "directory_metadata": {
    "path": "candidate/memory/core",
    "lane": "development",
    "purpose": "Directory containing 4 Python files and 6 subdirectories",
    "trinity_role": [],
    "last_updated": "2025-09-20"
  },
  "component_inventory": {
    "python_files": [
      {
        "filename": "base_manager.py",
        "component_type": "MEMORY_INTERFACE",
        "has_contract": false,
        "contract_path": null,
        "dependencies": [
          "candidate.core.common.logger",
          "candidate.core.glyph.glyph_engine"
        ],
        "exports": [
          "BaseMemoryManager",
          "generate_memory_id",
          "get_l_traces",
          "get_consciousness_patterns"
        ]
      },
      {
        "filename": "colony_memory_validator.py",
        "component_type": "MEMORY_INTERFACE",
        "has_contract": false,
        "contract_path": null,
        "dependencies": [],
        "exports": [
          "ValidationMode",
          "ConsensusResult",
          "ValidationRequest",
          "ColonyValidationResponse",
          "ConsensusOutcome",
          "ColonyMemoryValidator",
          "register_colony",
          "unregister_colony",
          "register_consensus_callback",
          "get_colony_stats",
          "get_metrics"
        ]
      },
      {
        "filename": "unified_memory_orchestrator.py",
        "component_type": "MEMORY_INTERFACE",
        "has_contract": false,
        "contract_path": null,
        "dependencies": [
          "candidate.core.common",
          "candidate.core.interfaces.memory_interface"
        ],
        "exports": [
          "MemoryType",
          "ConsolidationState",
          "SleepStage",
          "MemoryTrace",
          "OscillationPattern",
          "UnifiedMemoryOrchestrator",
          "to_dict",
          "get_memory_statistics",
          "run_memory_lifecycle_test",
          "run_error_condition_test",
          "get_comprehensive_memory_status",
          "test_memory_lifecycle",
          "test_error_conditions"
        ]
      },
      {
        "filename": "qi_memory_manager.py",
        "component_type": "MEMORY_INTERFACE",
        "has_contract": true,
        "contract_path": "contracts/consciousness/qi_memory_manager.json",
        "dependencies": [],
        "exports": [
          "EnhancedMemoryManager",
          "EnhancedMemoryFold",
          "MemoryFoldConfig",
          "EnhancedMemoryVisualizer",
          "VisualizationConfig",
          "QIOscillator",
          "get_active_folds"
        ]
      }
    ],
    "subdirectories": [
      {
        "name": "tracker",
        "has_index": false,
        "purpose": "Subdirectory with 1 Python files",
        "component_count": 1
      },
      {
        "name": "chain",
        "has_index": false,
        "purpose": "Subdirectory with 1 Python files",
        "component_count": 1
      },
      {
        "name": "expansion",
        "has_index": false,
        "purpose": "Subdirectory with 1 Python files",
        "component_count": 1
      },
      {
        "name": "brain",
        "has_index": false,
        "purpose": "Subdirectory with 1 Python files",
        "component_count": 1
      },
      {
        "name": "logging",
        "has_index": false,
        "purpose": "Subdirectory with 1 Python files",
        "component_count": 1
      },
      {
        "name": "interfaces",
        "has_index": false,
        "purpose": "Subdirectory with 4 Python files",
        "component_count": 4
      }
    ],
    "documentation": []
  },
  "schema_references": [
    {
      "schema_name": "directory_index",
      "schema_path": "schemas/directory_index.schema.json",
      "validation_status": "valid"
    }
  ],
  "agent_guidance": {
    "recommended_approach": "Begin with documentation files, then explore core components",
    "key_files": [],
    "common_tasks": [],
    "prerequisites": [
      "Understanding of LUKHAS lane system",
      "Trinity Framework familiarity"
    ],
    "avoid_patterns": [
      "Modifying contracts without validation",
      "Breaking lane boundaries",
      "Ignoring Trinity Framework integration"
    ]
  },
  "performance_metadata": {
    "component_count": 4,
    "estimated_complexity": "low",
    "consciousness_integration": "none",
    "test_coverage": 85.0
  },
  "relationships": {
    "parent_directory": "candidate/memory",
    "related_directories": [],
    "constellation_cluster": "unknown",
    "dependency_weight": "moderate"
  }
}