{
  "schema_version": "2.0.0",
  "directory_metadata": {
    "path": "candidate/vivox/quantum_readiness",
    "lane": "development",
    "purpose": "Directory containing 1 Python files and 4 subdirectories",
    "trinity_role": [],
    "last_updated": "2025-09-20"
  },
  "component_inventory": {
    "python_files": [
      {
        "filename": "demo_qready.py",
        "component_type": "UTILITY",
        "has_contract": false,
        "contract_path": null,
        "dependencies": [],
        "exports": []
      }
    ],
    "subdirectories": [
      {
        "name": "core",
        "has_index": false,
        "purpose": "Subdirectory with 3 Python files",
        "component_count": 3
      },
      {
        "name": "integration",
        "has_index": false,
        "purpose": "Subdirectory with 2 Python files",
        "component_count": 2
      },
      {
        "name": "collapse",
        "has_index": false,
        "purpose": "Subdirectory with 2 Python files",
        "component_count": 2
      },
      {
        "name": "coherence",
        "has_index": false,
        "purpose": "Subdirectory with 2 Python files",
        "component_count": 2
      }
    ],
    "documentation": [
      {
        "filename": "IMPLEMENTATION_REPORT.md",
        "type": "other",
        "has_sync_header": false
      },
      {
        "filename": "TEST_FAILURES_ANALYSIS.md",
        "type": "other",
        "has_sync_header": false
      },
      {
        "filename": "README.md",
        "type": "README.md",
        "has_sync_header": false
      }
    ]
  },
  "schema_references": [
    {
      "schema_name": "directory_index",
      "schema_path": "schemas/directory_index.schema.json",
      "validation_status": "valid"
    }
  ],
  "agent_guidance": {
    "recommended_approach": "Begin with documentation files, then explore core components",
    "key_files": [
      "README.md"
    ],
    "common_tasks": [],
    "prerequisites": [
      "Understanding of LUKHAS lane system",
      "Constellation Framework familiarity"
    ],
    "avoid_patterns": [
      "Modifying contracts without validation",
      "Breaking lane boundaries",
      "Ignoring Constellation Framework integration"
    ]
  },
  "performance_metadata": {
    "component_count": 1,
    "estimated_complexity": "low",
    "consciousness_integration": "none",
    "test_coverage": 85.0
  },
  "relationships": {
    "parent_directory": "candidate/vivox",
    "related_directories": [],
    "constellation_cluster": "unknown",
    "dependency_weight": "moderate"
  }
}