{
  "schema_version": "2.0.0",
  "directory_metadata": {
    "path": "branding/ai_agents",
    "lane": "development",
    "purpose": "Directory containing 1 Python files and 0 subdirectories",
    "trinity_role": [],
    "last_updated": "2025-09-20"
  },
  "component_inventory": {
    "python_files": [
      {
        "filename": "brand_orchestrator.py",
        "component_type": "UTILITY",
        "has_contract": false,
        "contract_path": null,
        "dependencies": [],
        "exports": [
          "BrandOrchestrationTask",
          "BrandOrchestratorAgent",
          "BrandCreativityAdapter",
          "BrandVoiceAdapter",
          "BrandPersonalityAdapter",
          "BrandMonitoringAdapter",
          "BrandIntelligenceMonitor",
          "BrandSentimentEngine",
          "RealTimeBrandValidator",
          "SentimentPolarity",
          "SentimentResult",
          "ValidationSeverity",
          "ValidationResult",
          "register_orchestration_callback",
          "get_orchestration_status",
          "generate_brand_creative_content",
          "generate_brand_voice",
          "express_brand_personality",
          "collect_brand_metrics",
          "analyze_brand_consistency",
          "analyze_sentiment"
        ]
      }
    ],
    "subdirectories": [],
    "documentation": [
      {
        "filename": "ux-content-strategist.md",
        "type": "other",
        "has_sync_header": false
      }
    ]
  },
  "schema_references": [
    {
      "schema_name": "directory_index",
      "schema_path": "schemas/directory_index.schema.json",
      "validation_status": "valid"
    }
  ],
  "agent_guidance": {
    "recommended_approach": "Begin with documentation files, then explore core components",
    "key_files": [],
    "common_tasks": [],
    "prerequisites": [
      "Understanding of LUKHAS lane system",
      "Constellation Framework familiarity"
    ],
    "avoid_patterns": [
      "Modifying contracts without validation",
      "Breaking lane boundaries",
      "Ignoring Constellation Framework integration"
    ]
  },
  "performance_metadata": {
    "component_count": 1,
    "estimated_complexity": "low",
    "consciousness_integration": "none",
    "test_coverage": 85.0
  },
  "relationships": {
    "parent_directory": "branding",
    "related_directories": [],
    "constellation_cluster": "unknown",
    "dependency_weight": "moderate"
  }
}