{
  "schema_version": "2.0.0",
  "directory_metadata": {
    "path": "candidate/core/orchestration/agents",
    "lane": "development",
    "purpose": "Directory containing 4 Python files and 1 subdirectories",
    "trinity_role": [],
    "last_updated": "2025-09-20"
  },
  "component_inventory": {
    "python_files": [
      {
        "filename": "registry.py",
        "component_type": "ORCHESTRATION_NODE",
        "has_contract": false,
        "contract_path": null,
        "dependencies": [],
        "exports": [
          "AgentRegistry",
          "register",
          "get_agent",
          "find_agents_by_capability",
          "list_agents"
        ]
      },
      {
        "filename": "multi_agent_collaboration.py",
        "component_type": "ORCHESTRATION_NODE",
        "has_contract": false,
        "contract_path": null,
        "dependencies": [],
        "exports": [
          "MultiAgentCollaboration",
          "register_agent",
          "create_task",
          "send_message",
          "update_task_progress",
          "complete_task"
        ]
      },
      {
        "filename": "types.py",
        "component_type": "ORCHESTRATION_NODE",
        "has_contract": false,
        "contract_path": null,
        "dependencies": [],
        "exports": [
          "AgentCapability",
          "AgentContext",
          "AgentResponse"
        ]
      },
      {
        "filename": "base.py",
        "component_type": "ORCHESTRATION_NODE",
        "has_contract": false,
        "contract_path": null,
        "dependencies": [],
        "exports": [
          "OrchestrationAgent",
          "get_agent_id",
          "get_capabilities",
          "process",
          "validate_context",
          "get_metadata"
        ]
      }
    ],
    "subdirectories": [
      {
        "name": "builtin",
        "has_index": false,
        "purpose": "Subdirectory with 3 Python files",
        "component_count": 3
      }
    ],
    "documentation": []
  },
  "schema_references": [
    {
      "schema_name": "directory_index",
      "schema_path": "schemas/directory_index.schema.json",
      "validation_status": "valid"
    }
  ],
  "agent_guidance": {
    "recommended_approach": "Begin with documentation files, then explore core components",
    "key_files": [],
    "common_tasks": [],
    "prerequisites": [
      "Understanding of LUKHAS lane system",
      "Trinity Framework familiarity"
    ],
    "avoid_patterns": [
      "Modifying contracts without validation",
      "Breaking lane boundaries",
      "Ignoring Trinity Framework integration"
    ]
  },
  "performance_metadata": {
    "component_count": 4,
    "estimated_complexity": "low",
    "consciousness_integration": "none",
    "test_coverage": 85.0
  },
  "relationships": {
    "parent_directory": "candidate/core/orchestration",
    "related_directories": [],
    "constellation_cluster": "unknown",
    "dependency_weight": "moderate"
  }
}