{
  "schema_version": "2.0.0",
  "directory_metadata": {
    "path": "candidate/memory/protection",
    "lane": "development",
    "purpose": "Directory containing 1 Python files and 1 subdirectories",
    "trinity_role": [],
    "last_updated": "2025-09-20"
  },
  "component_inventory": {
    "python_files": [
      {
        "filename": "symbolic_quarantine_sanctum.py",
        "component_type": "MEMORY_INTERFACE",
        "has_contract": false,
        "contract_path": null,
        "dependencies": [],
        "exports": [
          "QuarantineStatus",
          "RepairProtocolType",
          "ThreatLevel",
          "RestoreViability",
          "QuarantineEntry",
          "RepairProtocol",
          "SanctumManifest",
          "SymbolicQuarantineSanctum",
          "main",
          "to_dict",
          "add_audit_entry",
          "to_dict",
          "to_dict",
          "get_quarantine_status",
          "get_sanctum_report",
          "register_governor_callback",
          "register_sentinel_callback",
          "register_archive_callback",
          "cool_value",
          "cool_structure"
        ]
      }
    ],
    "subdirectories": [
      {
        "name": "sanctum_vault",
        "has_index": false,
        "purpose": "Subdirectory with 1 Python files",
        "component_count": 1
      }
    ],
    "documentation": []
  },
  "schema_references": [
    {
      "schema_name": "directory_index",
      "schema_path": "schemas/directory_index.schema.json",
      "validation_status": "valid"
    }
  ],
  "agent_guidance": {
    "recommended_approach": "Begin with documentation files, then explore core components",
    "key_files": [],
    "common_tasks": [],
    "prerequisites": [
      "Understanding of LUKHAS lane system",
      "Trinity Framework familiarity"
    ],
    "avoid_patterns": [
      "Modifying contracts without validation",
      "Breaking lane boundaries",
      "Ignoring Trinity Framework integration"
    ]
  },
  "performance_metadata": {
    "component_count": 1,
    "estimated_complexity": "low",
    "consciousness_integration": "none",
    "test_coverage": 85.0
  },
  "relationships": {
    "parent_directory": "candidate/memory",
    "related_directories": [],
    "constellation_cluster": "unknown",
    "dependency_weight": "moderate"
  }
}